{
  "engagement_id": "eng-cd2d13e6",
  "risk_tier": "high",
  "is_llm_or_agentic": false,
  "in_scope_articles": [
    "Annex_III",
    "Annex_IV",
    "Art.10",
    "Art.10\u00a72(f)",
    "Art.11",
    "Art.12",
    "Art.13",
    "Art.15",
    "Art.15\u00a71",
    "Art.17",
    "Art.43",
    "Art.5",
    "Art.50",
    "Art.6",
    "Art.72",
    "Art.9"
  ],
  "articles": [
    {
      "article": "Art.9",
      "verdict": "PASS",
      "evidence_uris": [],
      "supporting_template_ids": [],
      "source_phase": "P5",
      "rationale": null,
      "cgsa_control_ids": [],
      "blocking_findings": []
    },
    {
      "article": "Art.72",
      "verdict": "PASS",
      "evidence_uris": [],
      "supporting_template_ids": [],
      "source_phase": "P5",
      "rationale": null,
      "cgsa_control_ids": [],
      "blocking_findings": []
    },
    {
      "article": "Art.10\u00a72(f)",
      "verdict": "PASS",
      "evidence_uris": [],
      "supporting_template_ids": [],
      "source_phase": "ORCH",
      "rationale": null,
      "cgsa_control_ids": [],
      "blocking_findings": []
    },
    {
      "article": "Annex_III",
      "verdict": "PASS",
      "evidence_uris": [],
      "supporting_template_ids": [],
      "source_phase": "P1",
      "rationale": null,
      "cgsa_control_ids": [],
      "blocking_findings": []
    },
    {
      "article": "Art.43",
      "verdict": "PASS",
      "evidence_uris": [],
      "supporting_template_ids": [],
      "source_phase": "P1",
      "rationale": null,
      "cgsa_control_ids": [],
      "blocking_findings": []
    },
    {
      "article": "Annex_IV",
      "verdict": "PASS",
      "evidence_uris": [],
      "supporting_template_ids": [],
      "source_phase": "P1",
      "rationale": null,
      "cgsa_control_ids": [],
      "blocking_findings": []
    },
    {
      "article": "Art.10",
      "verdict": "PASS",
      "evidence_uris": [],
      "supporting_template_ids": [],
      "source_phase": "P2",
      "rationale": null,
      "cgsa_control_ids": [],
      "blocking_findings": []
    },
    {
      "article": "Art.13",
      "verdict": "PASS",
      "evidence_uris": [],
      "supporting_template_ids": [],
      "source_phase": "P1",
      "rationale": null,
      "cgsa_control_ids": [],
      "blocking_findings": []
    },
    {
      "article": "Art.5",
      "verdict": "PASS",
      "evidence_uris": [],
      "supporting_template_ids": [],
      "source_phase": "P1",
      "rationale": null,
      "cgsa_control_ids": [],
      "blocking_findings": []
    },
    {
      "article": "Art.12",
      "verdict": "PASS",
      "evidence_uris": [],
      "supporting_template_ids": [],
      "source_phase": "P5",
      "rationale": null,
      "cgsa_control_ids": [],
      "blocking_findings": []
    },
    {
      "article": "Art.11",
      "verdict": "PASS",
      "evidence_uris": [],
      "supporting_template_ids": [],
      "source_phase": "P1",
      "rationale": null,
      "cgsa_control_ids": [],
      "blocking_findings": []
    },
    {
      "article": "Art.15\u00a71",
      "verdict": "PASS",
      "evidence_uris": [],
      "supporting_template_ids": [],
      "source_phase": "ORCH",
      "rationale": null,
      "cgsa_control_ids": [],
      "blocking_findings": []
    },
    {
      "article": "Art.15",
      "verdict": "PASS",
      "evidence_uris": [],
      "supporting_template_ids": [],
      "source_phase": "P3",
      "rationale": null,
      "cgsa_control_ids": [],
      "blocking_findings": []
    },
    {
      "article": "Art.17",
      "verdict": "PASS",
      "evidence_uris": [],
      "supporting_template_ids": [],
      "source_phase": "P5",
      "rationale": null,
      "cgsa_control_ids": [],
      "blocking_findings": []
    },
    {
      "article": "Art.6",
      "verdict": "PASS",
      "evidence_uris": [],
      "supporting_template_ids": [],
      "source_phase": "P1",
      "rationale": null,
      "cgsa_control_ids": [],
      "blocking_findings": []
    },
    {
      "article": "Art.50",
      "verdict": "PASS",
      "evidence_uris": [],
      "supporting_template_ids": [],
      "source_phase": "P4",
      "rationale": null,
      "cgsa_control_ids": [],
      "blocking_findings": []
    }
  ],
  "kpi_summary": {
    "intake_completeness_score": null,
    "completeness_score": null,
    "regulatory_coverage_pct": null
  },
  "blocking_findings_count": 0,
  "final_verdict": "PASS_WITH_OBSERVATIONS",
  "generated_at": "2026-06-26T05:56:27.082253+00:00"
}